Nr.,Datum,Grund/Anlass,Ort bzw. Wegstrecke,Unnamed: 4,Unnamed: 5,Unnamed: 6
,,,,,,
1.0,2020-04-17 00:00:00,"Für Frauenrechte, insbesondere Abtreibung",Humboldtstraße – Kaiser-Joseph-Straße – Europaplatz (Zwischenkundgebung) – Kaiser-Joseph-Straße – Weberstraße – Merianstraße – Gauchstraße – Kartoffel-markt (Abschlusskundgebung) ,,,
2.0,2020-02-14 00:00:00,One billion rising,Platz der Alten Synagoge ,,,
3.0,2020-05-12 00:00:00,"Anerkennung, medizinische und soziale Versorgung, biomed. Forschung für ME (Myalgische Enzephalomy-elitis) /CFS (Chronic Fatigue Syndrome) Erkrankte",Platz der Alten Synagoge ,,,
4.0,"13.01. / 20.01.
27.01. / 03.02.
10.02. / 17.02.
02.03.2020","Soziale Ungerechtigkeit, Umweltschutz, Frieden",Ecke Bertoldstraße / Niemensstraße ,,,
5.0,"11.01.2020, 25.01.2020, 08.02.2020, 29.02.2020, 07.03.2020, 21.03.2020",Vegane Ernährung,Bertoldsbrunnen,,,
6.0,2020-01-24 00:00:00,Mahnwache gegen Altersarmut,Platz der Alten Synagoge,,,
7.0,2020-01-18 00:00:00,Tierversuche,Platz der Alten Synagoge - Sedanstraße – Konrad-Adenauer-Platz - Wiwilibrücke - Wentzingerstraße - Engelbergerstraße - Eschholzstraße - Breisacher Straße (Zwischenkundgebung mit Die-in vor der Baustelle des neuen Tierversuchslabors in der Breisacher Straße) - Breisacher Straße (zurück) - Zur Unterführung - Friedrichstraße - Rotteckring - Platz der Alten Synagoge.,,,
8.0,2020-01-17 00:00:00,Mahnwache für den Frieden,Bertoldsbrunnen,,,
9.0,2020-02-01 00:00:00,Versammlung zum Verbot der Internetplattform „linksunten.indymedia“,Bertoldsbrunnen,,,
10.0,2020-01-09 00:00:00,Mahnwache für den Frieden,Platz der Alten Synagoge,,,
11.0,2020-01-10 00:00:00,Klimagerechtigkeit,Konrad-Adenauer-Platz – je nach Teilnehmerzahl über Schnewlinstraße zur Siemens AG (Schnewlinstraße 6),,,
12.0,2020-01-25 00:00:00,"Infostand: Umweltschutz, Jugend, Inertaionale Soldarität",Platz der Alten Synagoge,,,
13.0,"20.01., 22.01., 27.01., 03.02., 04.02., 05.02., 07.02., 10.02., 11.02., 18.02., 26.02., 27.02., 28.02., 18.03., 19.03., 24.03., 26.03.2020",Mahnwache Verhandlungen Landgericht Freiburg sex. Missbrauch,"Landgericht Freiburg, Salzstraße 17, 79098 Freiburg i. Br.",,,
14.0,2020-01-13 00:00:00,Klimagerechtigkeit,Konrad-Adenauer-Platz – je nach Teilnehmerzahl über Schnewlinstraße zur Siemens AG (Schnewlinstraße 6),,,
15.0,2020-01-14 00:00:00,"Tierrechte, Veganismus",Bertoldsbrunnen,,,
16.0,2020-01-25 00:00:00,Welt-Aktionstag 5G Stopp,Rathausplatz (Auftaktkundgebung) – Rathausgasse – Rotteckring – Platz der Alten Synagoge (Zwischenkundgebung Bertoldstraße vor Buchhandlung „Walthari“) - Bertoldstraße – Bertoldsbrunnen (Zwischenkundgebung) – Kaiser-Joseph-Straße – Rathausgasse – Rathausplatz (Abschlusskundgebung).,,,
17.0,2020-01-17 00:00:00,Investitionen der Sparkasse in Braunkohle und Rüstung,vor der Sparkasse in der Kaiser-Joseph-Straße 186,,,
18.0,2020-01-16 00:00:00,Weltverbesserung,Platz der Alten Synagoge,,,
20.0,2020-01-25 00:00:00,Pressefreiheit,Platz der Alten Synagoge,,,
21.0,2020-01-18 00:00:00,Meeresschutz,Platz der Alten Synagoge,,,
22.0,2020-03-21 00:00:00,Kidical Mass (Fahrraddemo),Platz der Alten Synagoge – Rempartstraße – Holzmarkt – Wallstraße – Schwabentorring – Schlossbergring – Leopoldring – Friedrichring – Friedrichstraße – Zur Unterführung – Breisacher Straße – Eschholzstraße – Stühlingerstraße – Wentzingerstraße – Wiwilibrücke – Konrad-Adenauer-Platz – Schnewlinstraße – Bismarckallee – Friedrichstraße – Fahnenbergplatz – Rotteckring – Platz der Alten Synagoge (dort Abschlusskundgebung und Auflösung),,,
23.0,2020-01-18 00:00:00,"Hitlers politisches Testament und Zitate die die politische Lage der BRD heute spiegeln und die beweisen, dass Hitler die Wünsche heute und damals des Deutschen erfüllt",Bertoldsbrunnen,,,
24.0,2020-02-12 00:00:00,Mahnwache Internationaler Red Hand Day,Bertoldsbrunnen,,,
25.0,2020-01-31 00:00:00,Mahnwache für die Tiere,"Tullastr. 73, vor dem Schlachthof",,,
26.0,2020-01-21 00:00:00,"""Rave - Tanzen gegen Ungerechtigkeit und Umweltzerstörung (WWF in Davos)""",Platz der Alten Synagoge,,,
27.0,2020-01-25 00:00:00,"Cannabisprohibition und Kriminalisierung von Konsumenten, Patienten und Unternehmen",Platz der Alten Synagoge,,,
28.0,2020-01-24 00:00:00,Klimagerechtigkeit,Platz der Alten Synagoge - Bertoldstraße - Bertoldsbrunnen - Kaiser-Joseph-Straße - Europaplatz,,,
29.0,2020-02-08 00:00:00,Agrarpolitik der EU,Rathausplatz ,,,
30.0,2020-01-31 00:00:00,Mahnwache für Frieden,Bertoldsbrunnen,,,
31.0,2020-02-15 00:00:00,Mahnwache gegen Altersarmut,Platz der Alten Synagoge,,,
32.0,2020-01-24 00:00:00,Abschlussparty der Kapitalismus-kritischen Klimawoche,Audimax - Bertoldstraße - Bertoldsbrunnen - Kajo - Europaplatz - Friedrichring - Fahnenbergplatz,,,
33.0,2020-01-31 00:00:00,Protest gegen Kohleabbau,"Schnewlinstraße 6, vor der Siemens-Niederlassung",,,
34.0,2020-01-28 00:00:00,Autofreie Rempartstraße,"Rempartstraße, zwischen Mensa und Car-Sharingplätzen",,,
35.0,2020-01-31 00:00:00,Investitionen der Sparkasse in Braunkohle und Rüstung,vor der Sparkasse in der Kaiser-Joseph-Straße 186,,,
36.0,2020-02-01 00:00:00,StopAdani,"Schnewlinstraße 6, vor der Siemens-Niederlassung",,,
37.0,2020-02-01 00:00:00,Siemens handle verantwortlich StopAdani,"Ruhinger Weg St. Georgen, anschließend mit dem Fahrrad zur Schnewlinstr. 6 und in die Freiburger Innenstadt ",,,
38.0,2020-03-07 00:00:00,Internationaler Frauentag,Rathausplatz ,,,
39.0,2020-02-04 00:00:00,Aufklärung über Risiken von 5G,Rathausplatz,,,
40.0,2020-04-20 00:00:00,Hanf ist kein Verbrechen ,"PdAS mit Aufzug: Werthmannstr. - Rempartstr.-KaJo- Europaplatz- Friedrichring -Rotteckring-PdaS, ",,,
41.0,2020-02-08 00:00:00,Freiheit und Gerechtigkeit für Religion,Augustinerplatz,,,
42.0,2020-02-21 00:00:00,"Veganismus, Fastenzeit",Platz der Alten Synagoge,,,
43.0,2020-02-04 00:00:00,Autofreie Rempartstraße,"Rempartstraße, zwischen Mensa und Car-Sharingplätzen",,,
44.0,2020-02-07 00:00:00,"Besser nicht regieren, als mit Faschisten regieren.
Mahnwache gegen eine FDP geführte und von der AfD tolerierte Minderheitsregierung in Thüringen.
",Bertoldsbrunnen,,,
45.0,2020-02-07 00:00:00,Investitionen der Sparkasse in Braunkohle und Rüstung,vor der Sparkasse in der Kaiser-Joseph-Straße 186,,,
46.0,2020-02-08 00:00:00,Bundesweiter Aktionstag der Seebrücken #WirHaben-Platz,"Eisenbahnstraße 64 (auf dem Gehweg, dem schmalen Streifen zwischen den Bäu-men und auf dem Rand der Eisenbahnstraße)",,,
47.0,2020-02-06 00:00:00,Gegen AfD und FDP in Thüringen,Platz der Alten Synagoge - Bertoldstraße - Bertoldsbrunnen - Kaiser-Joseph-Straße - Schiffstraße - Unterlinden - Rotteckring - Platz der Alten Synagoge,,,
48.0,2020-02-14 00:00:00,Organspende: „Die PARTEI verschenkt ihr Herz“,Platz der Alten Synagoge,,,
49.0,2020-02-12 00:00:00,Ampelaktion zum Thema Tierrechte,Kreuzung Bismarckallee / Friedrichstr. ,,,
50.0,2020-02-14 00:00:00,Klimagerechtigkeit,Platz der Alten Synagoge,,,
51.0,2020-04-15 00:00:00,Schutz des ungeborenen Lebens,Humboldtstraße (Begrüßung und Gebet) – Kaiser-Joseph-Straße – Friedrichring – Rotteckring – Unterlinden – Schiffstraße – Kartoffelmarkt (Abschlusskundgebung),,,
52.0,2020-05-23 00:00:00,Legalisierung von Cannabis / „Global Marijuana March 2020“,Platz der Alten Synagoge - Bertoldstraße - Kaiser-Joseph-Straße - Europaplatz - Leopoldring - Auf der Zinnen - Herrenstraße - Oberlinden - Schwabentor - Greiffeneggring - Wallstraße - Holzmarkt - Rempartstraße - Belfortstraße - Wilhelmstraße - Bismarckallee - Friedrichstraße - Fahnenbergplatz - Rotteckring - Platz der Alten Synagoge.,,,
53.0,2020-04-24 00:00:00,Wir gegen Altersarmut,Platz der Alten Synagoge,,,
54.0,2020-03-14 00:00:00,Mahnwache: Fukushima nie vergessen,Rathausplatz,,,
55.0,2020-03-10 00:00:00,Mahnwache zu Tibet,Platz der Alten Synagoge,,,
56.0,"04.04.2020, 25.04.2020, 09.05.2020, 16.05.2020, 30.05.2020, 06.06.2020, 20.06.2020",Vegane Ernährung,"04.04.2020, 25.04.2020, 09.05.2020, 30.05.2020, 06.06.2020, 20.06.2020: 
Bertoldsbrunnen

16.05.2020:
Ecke Kaiser-Joseph-Straße/ Engelstraße
",,,
57.0,2020-02-20 00:00:00,Mahnwache bez. Attentat in Hanau,vor Johanneskirche,,,
58.0,2020-03-07 00:00:00,Frauentag/ Frauenrechte/ Gleichstellung,Rathausplatz,,,
59.0,2020-03-07 00:00:00,Nach Hanau: Stoppt die Medien-Hetze gegen die demokratische Oppositionspartei AfD - Volksbegehren gegen die Zwangsfinanzierung der öffentlich-rechtlichen Medien durch freie Bürger,SWR Gelände (Kartäuserstr) bis zum Bertoldbrunnen,,,
60.0,2020-03-03 00:00:00,Aktuelle Debatte im Gemeinderat über Straßenumbenennung,Rathausplatz,,,
61.0,2020-02-28 00:00:00,"Klimagerechtigkeit*

(* Es ist eine „Critical Mass“ mit dem Motto „Keine Automesse in Freiburg!“ geplant.)",Platz der Alten Synagoge – Werthmannstraße – Lessingstraße – Schillerstraße – Schwabentorring – Schlossbergring – Leopoldring – Friedrichring – Friedrichstraße – Zur Unterführung – Breisacher Straße – Eschholzstraße – Lehener Straße – Sundgauallee – Madisonallee (Abschlusskundgebung und Auflösung bei der Messe Freiburg),,,
62.0,2020-03-03 00:00:00,Kundgebung für die Straßenumbenennung und gegen die Aktion der AfD,Rathausplatz,,,
63.0,2020-03-03 00:00:00,Grenzen auf - Leben retten!,Platz der Alten Synagoge,,,
64.0,2020-03-07 00:00:00,aktuelle Fluchtbewegung an der Europäischen Grenze zur Türkei,Platz der Alten Synagoge,,,
65.0,"16.03., 23.03.,
30.03., 06.04.,
20.04., 27.04.,
04.05., 11.05.,
18.05., 25.05.,
08.06., 15.06.,
22.06., 29.06.,
06.07.2020 
","Soziale Ungerechtigkeit, Umweltschutz, Frieden",Bertoldstraße / Niemensstraße ,,,
66.0,2020-03-03 00:00:00,"Spomtanversammlung mit dem Thema ""Türkei / Krieg / Humanitäre Zustände""",Platz der Alten Synagoge,,,
67.0,2020-03-21 00:00:00,Internationaler Tag gegen Rassismus,Platz der Alten Synagoge,,,
68.0,2020-03-27 00:00:00,End-of-fishing Aktionstag,Bertoldsbrunnen,,,
69.0,2020-03-08 00:00:00,Frauen*Kampftag,Stühlingerplatz - Wiwilibrücke - Bismarckallee - Eisenbahnstr - Rotteckring - Bertoldstr - Bertoldsbrunnen - Kajo - Johanneskirche,,,
70.0,2020-04-12 00:00:00,Die Kirche und tierschutzrechtliche Themen,Münsterplatz,,,
71.0,2020-03-14 00:00:00,Nach Hanau: Stoppt die Medien-Hetze gegen die demokratische Oppositionspartei AfD - Volksbegehren gegen die Zwangsfinanzierung der öffentlich-rechtlichen Medien durch freie Bürger,,,,
72.0,2020-03-14 00:00:00,Gegendemo zur AfD,SWR Gelände (Kartäuserstr) bis zum Bertoldbrunnen,,,
73.0,2020-04-03 00:00:00,Klimagerechtigkeit ,Platz der alten Synagoge - Rempartstraße – Martinstor – KAJO/Bertoldsbrunnen -  Salzstraße - Schlossbergring  - Bahnhof/Bismarck- Allee – Willhelmstraße – Sedanstraße – Platz der alten Synagoge,,,
74.0,2020-03-12 00:00:00,Seebrücke,Platz der Alten Synagoge,,,
75.0,2020-03-14 00:00:00,Schwärmen fürs Klima,"Rathausplatz, Kreuzung Habsburgerstraße/ Europaplatz",,,
76.0,2020-03-14 00:00:00,"Spontanversammlung gegen ""Rechte Aktivitäten""","SWR Gelände, Kartäuserstraße",,,
77.0,2020-03-28 00:00:00,"Europäischer Aktionstag gegen den ""Mietenwahnsinn""",Fritz-Schieler-Platz,,,
78.0,2020-03-24 00:00:00,Ampelaktion zum Thema Tierrechte,Kreuzung Bismarckallee/ Friedrichstraße,,,
79.0,2020-03-17 00:00:00,Für eine Gesellschaft ohne Knäste,Tennenbacher Straße / Gießenstraße,,,
80.0,2020-03-19 00:00:00,"Jeder Mensch hat das Recht, Rechte zu haben",Lörracher Straße vor der LEA,bis hierhin 1. Quartal,,
81.0,2020-05-01 00:00:00,1. Mai,Seepark,,,
82.0,04.04.2020 oder 05.04.2020,„#LeaveNoOneBehind – bundesweiter Aktionstag am 05. April zur Evakuierung der griechischen Lager“ ,Nicht bekannt.,,,
83.0,2020-04-17 00:00:00,"""Tschüss Pius - Für das Recht auf körperliche und sexuelle Selbstbestimmung. Aufruf zum kreativen Protest gegen die fundamentalistiche Piusbrüderschaft""",Kartoffelmarkt,,,
84.0,2020-04-18 00:00:00,"Grundgesetz, Wahrung der Grundrechte",Münsterplatz und Platz der Alten Synagoge,,,
85.0,2020-04-19 00:00:00,Asylpolitik,Bismarckallee/ Wiwillibrücke,,,
86.0,2020-04-22 00:00:00,Kritik an der Politik der Flüchtlingsaufnahme und –unterbringung in Landeserstaufnahmeeinrichtungen des Landes Baden-Württemberg,Gehweg Lörracherstraße/ Bereich Landeserstaufnahmeeinrichtung,,,
87.0,2020-04-24 00:00:00,"Bundesweite Protestaktion ""Leere Stühle""",Platz  der Alten Synagoge,,,
88.0,2020-04-24 00:00:00,Nach Corona nicht weiter wie bisher,Rathausplatz,,,
89.0,2020-04-25 00:00:00,Friedliche Versammlung zum Erhalt der Grundrechte,Rathausplatz,,,
90.0,2020-04-25 00:00:00,Keine Quarantäne für Freiheitsrechte,Platz der Alten Synagoge,,,
91.0,2020-04-25 00:00:00,"Grundgesetz, Wahrung der Grundrechte",Münsterplatz und Augustinerplatz,,,
92.0,2020-04-25 00:00:00,Friedliche Versammlung zum Erhalt der Grundrechte,Rathausplatz ,,,
93.0,2020-04-24 00:00:00,"Klimaschutz, Klimagerechtigkeit",Platz der Alten Synagoge,,,
94.0,2020-04-24 00:00:00,Mehr Platz für familienfreundlichen Fußverkehr und Physical Distancing entlang der Baslerstraße,Arne-Torgersen-Str.-Eschholzstr.-Baslerstr. (bis zur Kreuzung Heinrich-von-stephan-str.)-gleicher Weg wieder zurück (auf der anderen Straßenseite),,,
95.0,2020-04-26 00:00:00,Pop-Up Bikelane,Schwabentorring/Schlossbergring (Absperrung der Strecke),,,
96.0,2020-04-24 00:00:00,Klimaschutz ,Platz der Alten Synagoge,,,
97.0,2020-05-01 00:00:00,Verbesserung der Bedingungen für Sorgearbeitende in und nach der Corona-Pandemie,Münsterplatz,,,
98.0,2020-05-01 00:00:00,Solidarität für alle,Platz der Alten Synagoge,,,
99.0,2020-05-02 00:00:00,Friedliche Versammlung zum Erhalt der Grundrechte,Rathausplatz,,,
100.0,2020-05-02 00:00:00,Erhalt der deutschen Grundrechte und unserer Freiheit für Samstag,Nordseite Münsterplatz,,,
101.0,2020-04-25 00:00:00,Friedliche Versammlung zum Erhalt der Grundrechte,Rathausplatz ,,,
102.0,2020-04-29 00:00:00,"Türkei raus aus Kurdistan, Erdogan vors Kriegsverbrechergericht nach Den Haag...",Platz der Alten Synagoge,,,
103.0,2020-05-01 00:00:00,Aktuelle Lage der Seenotrettung im Mittelmeer und den Lagern auf Lesbos etc.“,Platz der Alten Synagoge,,,
104.0,2020-05-02 00:00:00,Corona ist gefährlich. Die Wirtschaftkrise auch.,Rotteckring 4,,,
105.0,2020-05-02 00:00:00,"Grundgesetz, Wahrung der Grundrechte",Kartoffelmarkt,,,
106.0,"04.05., 11.05.,
18.05., 25.05.,
08.06., 15.06.,
22.06., 29.06.,
06.07.2020 
","Soziale Ungerechtigkeit, Umweltschutz, Frieden",Bertoldstraße / Niemensstraße ,,,
107.0,2020-05-09 00:00:00,Initiative Lieferkettengesetz,Gerberau 12-14,,,
108.0,2020-05-02 00:00:00,“Corona ist zur Chiffre geworden für den Missbrauch der Ängste und Sorgen der Bürger durch Regierungsverantwortliche. Nur Gerichte konnten den absoluten Grundrechtsbeschränkungen Einhalt gebieten. Die Kosten der Krise werden uns wie die übrigen Fehler der Regierung auf Jahrzehnte hin beschäftigen. Die AfD sagt: bleibt wachsam!”,Platz der Alten Syngoge,,,
109.0,2020-05-02 00:00:00,Aufstehen gegen Rassismus: Solidarität grenzenlos. Gegenprotest zu der AfD-Aktion.,auf der öffentlich zugänglichen Fläche vor der Universitätsbibliothek,,,
110.0,2020-05-02 00:00:00,"Für grenzenlose Solidarität und Antifaschismus: #LeaveNoOneBehind. Gegen Faschismus, AfD und Verschwörungstheoretiker.",Vorplatz des Stadttheaters ,,,
111.0,2020-05-02 00:00:00,Tanzschulen in Zeiten von Corona,Platz der Alten Synagoge,,,
112.0,2020-05-02 00:00:00,Die Quarantäne nicht auf unserem Rücken austragen - gegen Faschismus und Ausbeutung,Ecke Bertoldstraße / Niemensstraße ,,,
113.0,02.05.20.20,"Türkei raus aus Kurdistan, Erdogan vors Kriegsverbrechergericht nach Den Haag...",Platz der Alten Synagoge,,,
114.0,2020-05-05 00:00:00,Free Tobi and Hemp,vor Amtsgericht,,,
115.0,2020-05-05 00:00:00,Solidaritätsbekundung mit Bewohner*innen der LEA Freiburg,"auf dem Gehweg vor der Landeserstaufnahme Freiburg, Lörracher Straße",,,
116.0,2020-05-06 00:00:00,"Türkei raus aus Kurdistan, Erdogan vors Kriegsverbrechergericht nach Den Haag...",Rathausplatz,,,
117.0,2020-05-09 00:00:00,Grundgesetz (Verteilen von Grundgesetzen und Zeitungen an Interes-sierte),Platz der Alten Synagoge,,,
118.0,2020-05-09 00:00:00,Mahnwache für den Erhalt der deutschen Grundrechte und unserer Freiheit,Münsterplatz,,,
119.0,2020-05-09 00:00:00,Friedliche Versammlung zum Erhalt der Grundrechte und unserer Freiheit,Rathausplatz,,,
120.0,2020-05-09 00:00:00,Die Grundrechte unserer Demokratie verteidigen,Europaplatz,,,
121.0,2020-05-08 00:00:00,Kundgebung zum 75. Jahrestag des Endes von Krieg und NS-Herrschaft,"Mahnmal beim Rotteckhaus, Eisenbahnstraße",,,
122.0,2020-05-13 00:00:00,Welt Falun Dafa Tag + Verfolgung von Falan Dafa in China,Rathausplatz,,,
123.0,2020-05-09 00:00:00,"Türkei raus aus Kurdistan, Erdogan vors Kriegsverbrechergericht nach Den Haag...",Kartoffelmarkt,,,
124.0,2020-05-13 00:00:00,Rettet die Reisebüros,Platz der Alten Synagoge,,,
125.0,2020-05-09 00:00:00,Mehr Solidarität in Europa ,Platz der Alten Synagoge,,,
126.0,2020-05-12 00:00:00,Free Tobi and Hemp,vor Amtsgericht,,,
127.0,2020-05-10 00:00:00,Kundgebung anlässlich des 80. Jahrestags der Bombardierung Freiburgs durch eine versehentlichen deutschen Fliegerangriff,Hildaspielplatz,,,
128.0,2020-05-08 00:00:00,Zum 75 Jahrestag des Endes von Krieg und NS-Herrschaft,"Konrad-Adenauer-Platz – Wilhelmstraße – Rotteckring – Platz der Alten Synagoge – Rotteckring –
Merianstraße bis Hermann-Herder-Straße – Habsburgerstraße - Europaplatz – Kaiser-Joseph-Straße –
Dreisamstraße – Goethestraße – Lorettostraße – Baslerstraße – Kronenbrücke – Rehlingstraße –
Heinrich-von-Stephan-Straße – Schnewlinstraße – Bismarckalle –Wiwili-Brücke – Stühlinger Kirchplatz",,,
129.0,2020-05-16 00:00:00,Tanzmeditation für Menschlichkeit,Platz der Alten Synagoge,,,
130.0,2020-05-16 00:00:00,Grundgesetz (Verteilen von Grundgesetzen und Zeitungen an Interessierte),Platz der Alten Synagoge,,,
131.0,2020-05-15 00:00:00,Klimagerechtigkeit,Platz der Alten Synagoge (Auftaktkundgebung) - Rotteckring - Friedrichring - Leopoldring - Schlossbergring - Greiffeneggring - Dreisamstraße - Schreiberstraße - Werthmannstraße - Kronenstraße - Basler Straße - Feldbergstraße - Staufener Straße - Markgrafenstraße - Haslacher Straße - Eschholzstraße - Engelbergerstraße - Wentzingerstraße - Wiwilibrücke – Konrad-Adenauer-Platz - Wilhelmstraße - Sedanstraße – Platz der Alten Synagoge (Abschlusskundgebung).,,,
132.0,2020-05-17 00:00:00,Zusammen alleine tanzen,Platz der Alten Synagoge,,,
133.0,2020-05-16 00:00:00,Mahnwache für den Erhalt der deutschen Grundrechte und unserer Freiheit,Münsterplatz,,,
134.0,2020-05-16 00:00:00,Meditation für das Grundgesetz,Rathausplatz,,,
135.0,2020-05-16 00:00:00,Friedliche Versammlung zum Erhalt der Grundrechte und unserer Freiheit,Augustinerplatz,,,
136.0,2020-05-29 00:00:00,"Altersarmut, Misstände bei der Rente, Wirtschaftskrise und Grundrechte",Platz der Alten Synagoge,,,
137.0,2020-05-22 00:00:00,Die Bewegung der Lebensfreude,Platz der Alten Synagoge,,,
138.0,2020-05-23 00:00:00,Grundgesetz (Verteilen von Grundgesetzen und Zeitungen an Interessierte),Platz der Alten Synagoge,,,
139.0,2020-05-23 00:00:00,Tag des Grundgesetzes,Platz der Alten Synagoge,,,
140.0,2020-05-22 00:00:00,Protest gegen Atomwaffeneinsatz,Platz der Alten Synagoge,,,
141.0,2020-05-23 00:00:00,"Freiheit für alle politischen Gefangenen, etc.",Rathausplatz,,,
142.0,2020-05-23 00:00:00,Mahnwache für den Erhalt der deutschen Grundrechte und unserer Freiheit,Münsterplatz,,,
143.0,2020-05-23 00:00:00,Pop-Up Bikelane,Schlossbergring,,,
144.0,2020-05-26 00:00:00,We want To-bi free,"vor dem Amtsgericht Freiburg, Holzmarkt 2 (Gehwegbereich in der Kaiser-Joseph-Straße und entlang des Holzmarkts)",,,
145.0,2020-05-23 00:00:00,"Deutschland sollte in Europa wie Schweden Vorbild im Management der Krise sein!
Bevor aus eine Gesundheitskrise eine unrettbare Wirtschaftskrise bzw -Depression erwächst das im Kollaps der Europäische Sozialdemokratie und Europäische Union enden kann.
",Ecke Rempartstraße auf der Grünfläche beim Mensa-Brunnen  ,,,
146.0,2020-05-23 00:00:00,menschenunwürdige Situation in den Lagern in Griechenland und die Seenotrettung,Europaplatz,,,
147.0,2020-05-23 00:00:00,menschenunwürdige Situation in den Lagern in Griechenland und die Seenotrettung,Rathausplatz,,,
148.0,2020-05-23 00:00:00,Aufhebung der Beschränkungen der Corona-Verordnung des Landes Baden-Würrtemberg für Laufgruppen,Maierbuckallee 4 (Start) – Maierbuckallee  – Tunibergstraße – Tuniberg (entlang den Weinreben) – Tunibergstraße - Maierbuckallee.,,,
149.0,2020-05-15 00:00:00,Inhaftierung zweier Bürgermeister in der Türkei,Europaplatz,,,
150.0,2020-05-23 00:00:00,Für linke Intervebtione gegen die Krise - Gegen Populismus und Verschwörungstheorien,Bertoldsbrunnen,,,
151.0,2020-06-01 00:00:00,Schutz der Kindheit,Platz der Alten Synagoge,,,
152.0,2020-05-30 00:00:00,Solidarität mit den Arbeiter*innen der Tierindustrie,Platz der Alten Synagoge,,,
153.0,2020-05-28 00:00:00,We want To-bi free,"vor dem Amtsgericht Freiburg, Holzmarkt 2 (Gehwegbereich in der Kaiser-Joseph-Straße und entlang des Holzmarkts)",,,
154.0,"27.05.2020
30.05.2020
03.06.2020
06.06.2020",Aufhebung der Beschränkungen der Corona-Verordnung des Landes Baden-Württemberg für Laufgruppen,Maierbuckallee – Tunibergstraße – Tuniberg (entlang den Weinreben) – Tunibergstraße - Maierbuckallee ,,,
155.0,2020-05-28 00:00:00,Forderung der Freilassung von aus politischen Gründen inhaftierten Journalisten in der Türkei (Gründungstag von Amnesty International),Platz der Alten Synagoge,,,
156.0,2020-06-01 00:00:00,Mahnwache Tierrechte,Münsterplatz,,,
157.0,2020-06-01 00:00:00,Kirche und Tierschutz,Münsterplatz,,,
158.0,2020-05-31 00:00:00,Zusammen alleine tanzen,Platz der Alten Synagoge,,,
159.0,2020-05-29 00:00:00,"Tanzen ist Systemrelevant für das Immunsystem. Tanzschulen bitte nicht zerstören! Die neuen Auflagen von Baden-Württemberg für Tanzschulen bedeuten das aus für viele kleine Tanzschulen, besonderes in Verbindung mit der Tatsache das keine weitere Hilfsmaßnahmen angekündigt sind.",Ecke Rempartstraße auf der Grünfläche beim Mensa-Brunnen  ,,,
160.0,2020-05-30 00:00:00,Nach Corona nicht weiter so,Rathausplatz,,,
161.0,2020-05-30 00:00:00,Mahnwache für den Erhalt der deutschen Grundrechte und unserer Freiheit,Münsterplatz,,,
162.0,2020-05-28 00:00:00,Die Bewegung der Lebensfreude,Platz der Alten Synagoge,,,
163.0,2020-05-30 00:00:00,Grundgesetz (Verteilen von Grundgesetzen und Zeitungen an Interessierte),Platz der Alten Synagoge,,,
164.0,2020-05-29 00:00:00,Verkehrswende statt #Abfckprämie,Platz der Alten Synagoge,,,
165.0,2020-06-02 00:00:00,Klimagerechtigkeit,Platz der Alten Synagoge,,,
166.0,2020-05-30 00:00:00,Flüchtlinge im Lager Moria (Griechenland),Rathausplatz,,,
167.0,2020-05-30 00:00:00,Immunkräfte stärken - Strahlenbelastung mindern,Vorplatz des Stadttheaters ,,,
168.0,2020-06-06 00:00:00,Kritik an der Lagerunterbringung von Geflüchteten,"auf dem Gehweg vor der Landeserstaufnahme Freiburg, Lörracher Straße",,,
169.0,2020-06-03 00:00:00,Weltkulturerbe Tango Argentino retten,Rathausplatz,,,
170.0,2020-06-06 00:00:00,Schutz der Grundrechte,Platz der Alten Synagoge,,,
171.0,2020-06-06 00:00:00,Mahnwache in Gedenken an George Floyd,Platz der Alten Synagoge,,,
172.0,2020-06-06 00:00:00,Friedensdemo für junge Menschen - Impulse für die Zukunft,Platz der Alten Synagoge,,,
173.0,2020-06-06 00:00:00,Mahnwache für den Erhalt der deutschen Grundrechte und unserer Freiheit,Münsterplatz (Nordseite),,,
174.0,2020-06-10 00:00:00,Zusammen gegen Rassismus,Platz der Alten Synagoge,,,
175.0,2020-06-30 00:00:00,Fessenheim Abschaltung - Eine Zukunft ohne Atomstrom,Platz der Alten Synagoge,,,
176.0,2020-06-06 00:00:00,"Gewalt gegen Frauen in Kurdistan sichtbar machen - Täter zur
Verantwortung ziehen
Gewalt gegen Frauen bekämpfen
Die türkische Regierung vor das Kriegsverbrechertribunal in Den Haag
Gegen Faschismus, Nationalismus und Patriarchat
",Rathausplatz,,,
177.0,2020-06-27 00:00:00,Wasser und Klima,Platz der Alten Synagoge,,,
178.0,2020-06-12 00:00:00,Gerechtigkeit für George Floyd - Gegen rassistische Polizeigewalt,Einkaufszentrum Weingarten in der Krozinger Straße,,,
179.0,2020-06-27 00:00:00,Frauen für den Frieden,Rathausplatz,,,
180.0,2020-06-06 00:00:00,Freiburg All Black,Platz der Alten Synagoge,,,
181.0,2020-06-06 00:00:00,Black divers Matter,Platz der Alten Synagoge,,,
182.0,2020-06-05 00:00:00,Die Bewegung der Lebensfreude,Platz der Alten Synagoge,,,
183.0,2020-06-06 00:00:00,Nein zu Rassismus - gemeinsam sind wir startk,Platz der Alten Synagoge,,,
184.0,2020-06-09 00:00:00,Stand up for love -> Hochzeitsdienstleister brauchen Perspektive,Platz der Alten Synagoge,,,
185.0,2020-06-11 00:00:00,Wie es nach Corona weitergeht,Platz der Alten Synagoge,,,
186.0,2020-06-12 00:00:00,Die Bewegung der Lebensfreude,Platz der Alten Synagoge,,,
187.0,2020-06-13 00:00:00,Schutz der Grundrechte,Platz der Alten Synagoge,,,
188.0,2020-06-14 00:00:00,"#sogehtsolidarisch - Menschenkette für eine solidarische Gesellschaft, die auch trotz Corona alle Menschen berücksichtigt.",Werthmannstraße-PdAS-Rotteckring-Fahnenbergplatz.,,,
189.0,2020-06-16 00:00:00,Zusammen alleine tanzen,Platz der Alten Synagoge,,,
190.0,2020-06-13 00:00:00,Verfolgung von Falun Dafa in China,Rathausplatz,,,
191.0,2020-06-13 00:00:00,"Frieden und Freiheit in Kurdistan
Die türkische Regierung vor das Kriegsverbrechertribunal in Den Haag 
Gegen Faschismus, Nationalismus und Patriarchat",Kartoffelmarkt,,,
192.0,2020-06-13 00:00:00,Erhalt des Naturgutes Tanz,Rempartstraße Mensa-Brunnen,,,
